Topic,Top Terms
Telecommunications,gpr properties ground-penetrating measurement modeling simulation subsurface layer weather fdtd characterization soil experimental electromagnetic permittivity complex reflectivity mode study response
Image Processing-1,water radiometer microwave vapor atmospheric cloud over content correction ghz tropospheric clouds scanning liquid retrievals measured spaceborne parameters frequency description
Social Issues and Practice-2,resolution high spatial texture speckle decomposition improved enhancement spectral urban very multispectral reconstruction filtering multiscale areas adaptive target ship feature
Image Processing-2,ice sea comparison arctic snow between over sheet concentration regions signatures greenland scatterometer determination roughness ssm/i antarctic observations properties amsr-e
Telecommunications-1,microwave temperature brightness observations airborne ground-based radiometry precipitation temperatures during global system experiment multifrequency millimeter-wave variations rfi validation sounder modeling
Bioinformatics-3,modeling waves surfaces models sea transfer radiative backscatter microwave study applications backscattering numerical comparison wave methods incidence theory spectrum rough
Image Processing-4,calibration special radiometric performance issue foreword sensor modis imager spectral infrared bands sensors on-orbit characterization solar channels microwave instrument evaluation
Image Processing-5,land over modis cover temperature infrared emissivity validation study thermal global aerosol atmospheric case mapping products evaluation oil product optical
Social Issues and Practice-5,system compression interferometry monitoring correction doppler spaceborne atmospheric envisat ground-based high-resolution techniques frequency asar motion lossless observation topographic application earth
Social Issues and Practice-6,spectral information fusion spatial unmixing approach system linear mixture models multisensor selection applied through statistical fully methods subpixel integration density
Telecommunications-2,target ground targets processing approach moving isar bistatic nonlinear dielectric transform small focusing clutter scaling design efficient new penetrating fast
Social Issues and Practice-8,extraction automatic robust registration urban optical via endmember high-resolution component adaptive signal network approach multitemporal lidar sparse matching representation applications
Telecommunications-3,comparison results simulation airborne tomography experimental efficient urban gps characterization areas technique bistatic scatterers interferometric ionospheric raw scenes signals signal
Social Issues and Practice-10,technique new polarization parameters two-dimensional inversion algorithms antenna rotation processing tomographic applications real-time faraday target two errors accurate field borehole
Telecommunications-4,airborne mapping laser topography parameter space lidar dem scanning altimeter tree area generation terrestrial topographic reconstruction three-dimensional stereo prediction building
Bioinformatics-12,microwave passive snow observations effects scatterometer active emission monitoring over use modeling backscatter rainfall c-band ers forests evaluation impact cloud
Image Processing-6,soil moisture l-band smos mission sea salinity ocean over results validation bare roughness radiometer products first observations assessment part application
Telecommunications-5,electromagnetic rough buried objects surfaces induction three-dimensional 3-d media reconstruction dielectric bistatic fast random lossy targets inversion inverse subsurface layered
Telecommunications-6,vegetation reflectance canopy area leaf forest index optical inversion distribution size spectral modis products correction hyperion attenuation aerosol multiangle validation
Telecommunications-7,approach remotely sensed segmentation change vector multispectral unsupervised bayesian support new linear fusion framework high-resolution multitemporal features machines fuzzy clustering
Social Issues and Practice-16,feature learning application interference classifier extraction identification selection methods novel automatic bayesian land-cover fuzzy frequency ordnance unexploded approach supervised active
Telecommunications-8,forest time series assessment interferometric quality interferometry biomass vegetation insar terrasar-x high-resolution accuracy coherence monitoring multitemporal height volume boreal estimating
Telecommunications-9,aperture synthetic digital interferometric color ocean noise interferometry system elevation synthesis performance differential processing removal algorithms models radiometers radiometry effects
Image Processing-8,phase wavelet unwrapping transform interferometric subspace noise modeling spectroradiometer instrument insar total comments filter misr approach joint filtering geophysical projection
Telecommunications-10,ocean random fields wave field markov spectra tracking current parameters thermal simulation absorption study point distribution space correlation impact internal
Telecommunications-11,neural wind network ocean calibration networks microwave spaceborne rain scatterometer application winds radiometers precipitation conditions vector retrievals technique windsat speed
