Topic,Top Terms
Telecommunications,content stereoscopic depth visual 3d-tv from perceived images viewing 3dtv generation effect disparity information conversion videos experience automatic protection distribution
Image Processing,data atsc novel design sequences based dtv antenna receivers approach sequence partial phase layered distributed modulation propagation transmit media videos
Telecommunications-1,reduction papr complexity low pts technique amplitude distribution tone efficient general based mapping domain transform companding without sequence solution reduce
Social Issues and Practice-3,control coding scalable rate joint applications streaming via frame dynamic real-time quantization model adaptation bit distortion consistent multiple mpeg media
Image Processing-1,carrier offset dvb-t2 maximum likelihood sampling offsets recovery based time joint compensation accurate cyclic codes ofdm-based urban uplink sfn interpolation
Image Processing-2,modulation new performance decoding ldpc coded ici cancellation mapping combining bit iterative blind selective application effects error-resilient rate monitoring audio
Image Processing-3,power reduction ratio peak-to-average nonlinear overview companding amplifiers transform linear development layered partial techniques architecture memory transmit variation general novel
Social Issues and Practice-6,based low motion optimization rate high complexity coding cost slm modified blind antenna modeling selective factor embedded disparity memory videos
Image Processing-4,error audio techniques concealment assessment subjective perceptual multicast wireless optimization code propagation under mac temporal h.264 hdtv dvb memory experience
Social Issues and Practice-8,performance t-dmb layer predistortion multicast objective methods physical comparison architecture repeaters assessment factor fast mac amplifiers symbols atm pilot codes
Image Processing-5,phase television noise standard effects review advanced ofdm-based measurements protocol dtmb methods urban development division chinese analytical communications memory streams
Telecommunications-2,hybrid satellite study model optimization schemes comparative network methods ofdma improved analytical 3dtv techniques cross-layer approach signal demand temporal quality-oriented
Social Issues and Practice-10,synchronization receiver chinese dttb robust improved code decoder standard application dvb-t2 frame combined embedded accurate spread design codes blind dtmb
Social Issues and Practice-11,detection timing effective symbol mode recovery frame generation compensation combined standard interpolation accurate conversion effect automatic code mpeg-2 error-resilient without
Information Retrieval-9,field measurements interference devices from channels adjacent presence part multiple single application power distributed variation dtv factors urban tests antenna
Image Processing-7,network signal single transmitter spectrum application dab efficiency overlay dtmb dvb-h diversity comments distributed effect sfn spread schemes dvb-t2 heterogeneous
Social Issues and Practice-13,delivery scheduling docsis allocation access dvb cable upstream multiple protocol transmissions improved spread resource delay cross-layer quality-oriented sfn heterogeneous strategies
Social Issues and Practice-14,efficient streaming h.264 packet motion information interpolation recovery loss vector dynamic h.264/avc data high-speed subjective without mpeg codes reduce hdtv
Bioinformatics-9,new radio band indoor approach uhf local positioning measurements loss mondiale solution tests characterization bands embedded dvb-t2 experience factors environment
Social Issues and Practice-15,diversity channels transmit equalization delay measurement fading receivers tds-ofdm fast design iterative dvb-t/h selective low-complexity performance improved cyclic dvb-t padding
Software Engineering-9,based decision feedback equalizer implementation pilot dtv mode correlation pilot-aided distortion symbols propagation repeaters uplink structure hybrid hdtv fast cancellation
Telecommunications-3,continuous novel environment tds-ofdm corrections recovery enhancement clock linear padding adaptation media combined heterogeneous considering reduce without urban environments hdtv
Image Processing-9,multiplexing statistical bandwidth encoded h.264/avc svc traffic streams vbr buffering advanced allocation effects division characterization high-speed mpeg consistent mpeg-2 videos
Bioinformatics-12,dvb-h based coverage models image drm applications decoding monitoring tests fading audio mondiale heterogeneous development urban bands quality-oriented cyclic memory
Telecommunications-4,reception prediction field trials medium synthesis band from view results wave empirical drm impact dtmb urban consistent variation sfn environments
Image Processing-10,dvb-t modeling interference applications hpa television analog predistorter co-channel cancellation generation impact service dttb bands memory analytical accurate ofdm-based spread
Image Processing-11,wireless evaluation performance service broadband dtv interactive access cellular techniques distribution resource approach heterogeneous factors quality-oriented hdtv protection measurement prediction
Social Issues and Practice-18,coding algorithms based hierarchical video-on-demand fast structure selection users frame temporal optimal combining efficient experience protection environments heterogeneous accurate cyclic
Image Processing-12,time on-channel domain equalization delay repeater hybrid zapping correction demand reception under uplink modulation cyclic communications video-on-demand experience environments reduce
