Topic, Top Terms
Topic 00, partial problem evaluation solution pattern matching bounds space comments strings some can fast parameterized denotational subtyping parallelism note tests pointer
Topic 01, parallel generation machines optimal tree state proving finite networks communicating evaluation liveness hierarchical analyses abstraction layout correct adaptive caching uniform
Topic 02, verification concurrent prolog properties via liveness processes denotational concurrency resource asynchronous theory objects dataflow local rules proving parametric synchronization passing
Topic 03, specifications processes synthesis proof sequential correctness communicating proofs computations system design from temporal axiomatic toward reduction mobile optimizing development csp
Topic 04, functional calculus loops design practical predicate recursion operations floating-point polymorphic equations study development abstraction compilation handling access concurrency probabilistic adaptive
Topic 05, based communication scheduling linear grammar data-flow evaluator management global attribute storage trace complexity software higher-order parallelism functions constraints user probabilistic
Topic 06, machine storage transformations objects software theory instructions handling construction services functions note study synchronization information resource parsing polymorphic editorial constraints
Topic 07, program time slicing dependence transformation structures support use development new transformations abstraction theory software compilation definition through parallelization study tests
Topic 08, error modular recovery flexible parsers syntactic global environments repair new syntax parsing problems user abstraction functions generating higher-order constraint refinement
Topic 09, graph bytecode form computing assignment translation reduction constraint vector on-the-fly rules construction structured editorial object standard objects synchronization iteration functions
Topic 10, incremental algorithm evaluation grammars attribute interpretation propagation lazy hierarchical constraint part demand-driven parsing editors trees case constraints caching dataflow translation
Topic 11, concurrent variables symbolic experimental representations objects debugging optimized compilers polymorphic implementing denotational typing resource software demand-driven analyses modules passing note
Topic 12, compiler framework allocation register embedded fast memory via cache performance equations software demand-driven processors pointer machine typed axiomatic iteration compile-time
Topic 13, termination algorithms garbage detection collection algorithm derivation transformational its lisp from on-the-fly object handling machine trees descriptions reference csp constraints
Topic 14, system interprocedural formal inference recursive effective from definitions shape eliminating pointer polymorphic definition csp typed software constraint subtyping generating access
Topic 15, techniques rewriting without temporal binary verifying compaction management memory environments software through objects debugging translation dataflow syntax local typed processors
Topic 16, execution technique applications automated compilation compilers machine optimizations conversion software repair safe loop objects ada correct computations information functions transformations
Topic 17, model checking reasoning about new shared relational method probabilistic real-time abstraction software cost theory trees translation local interfaces web compile-time
Topic 18, expressions computation array memory graphs algebraic practical iterative errors fast access higher-order definition pointer vector through reference processors dataflow analyses
