Topic, Top Terms
Topic 0, scheduling prefetching disk security implementation effective parallel file approach protection caching multiprocessors synchronization algorithms processors database programs heterogeneous based improving
Topic 1, networks control algorithm approach i/o evaluation new traffic exclusion mutual algorithms access measurement processors management feedback service multiprocessors high-speed atomic
Topic 2, network dynamic shared efficient support virtual software parallel computing shared-memory run-time processing interface multiprocessors management architectural programs algorithms lightweight architectures
Topic 3, file applications via behavior i/o fast processors based multiprocessors multicore fault secure recovery storage energy-efficient tolerance database editorial management algorithms
Topic 4, special preface issue programming storage tolerance fault service algorithms management multiprocessors architectural editorial synchronization lightweight reliable power measurement large-scale mutual
Topic 5, real-time multiprocessor objects support applications kernel management service atomic modeling storage algorithms architectures tolerance reliable multicast database editorial fault multiprocessors
Topic 6, design model evaluation continuous services formal replicated consistency methods hardware availability service atomic management simulation secure processors power multiprocessors speculative
