Topic, Top Terms
Topic 0, process data real-time environment languages environments class information program through evolution temporal symbolic code programming support generation source path detecting
Topic 1, development impact effort empirical coordination tools improving languages study evaluation its metrics architectural information ada environment automatic class formalizing detecting
Topic 2, checking component theory supporting composition tools information consistency real-time symbolic based class detection process temporal reliability constraints environment use uml
Topic 3, specification mobile computing reasoning programming code detection components evaluation modeling class environment architectural about system languages consistency metrics information processes
Topic 4, static properties using dynamic about reasoning system information constraints safety environments class tool reliability environment implementation code checking metrics evaluation
Topic 5, applications method visual web behavior studies designing process service real-time reliability ada languages programming modeling detecting class detection automatic environment
Topic 6, using programs java concurrent models detection information process environments object tool behavior implementation logic automatic real-time metrics based reliability environment
Topic 7, study engineering modeling empirical program framework size process class regression metrics environments integration evolution evaluation designing data suite processes formalizing
Topic 8, from models control case security use system its uml process based model-based data experimental automatic environment class development metrics programming
