Topic, Top Terms
Topic 0, model policy intrusion role-based protocols protocol information anonymous wireless group dynamic xml logic communication modeling networks detecting rfid documents role
Topic 1, encryption using automated negotiation trust through policies cryptographic role-based intrusion xml about logic storage implementations formal information dynamic operating detecting
Topic 2, editorial special models guest computer communications support role-based anonymous about environments policy model information role against its rfid modeling anonymity
Topic 3, authorization management specification constraints enforcement role-based model policy dynamic intrusion encrypted rbac protocols administration new detecting information group rfid against
Topic 4, networks practical using revocation scheme anonymous encryption rfid storage intrusion sensor models xml wireless against role-based policy protocols dynamic group
Topic 5, efficient policies enforcement cryptographic policy protocols role-based anonymous dynamic logic intrusion against model multicast schemes new information formal encryption operating
Topic 6, trust integrity dynamic protocols intrusion role-based rfid policy anonymous anonymity private rbac protocol formal tls implementations information group storage against
Topic 7, applications network sensor schemes routing new storage protocols multicast private anonymity networks its approach protocol encryption intrusion model policy wireless
