Topic, Top Terms
Topic 00, vector quantization rate-distortion computation selection optimized integrated picture encoding strategy optimal wavelet arbitrary search classified transforms reference differential verification avc
Topic 01, system applications processing digital watermarking processor implementation hdtv multimedia parallel high-performance codec signal data chip vision jpeg2000 reconfigurable hybrid processors
Topic 02, retrieval segmentation content-based approach extraction semantic object indexing applications interactive unified from application binary field systems relevance audio-visual shape feedback
Topic 03, matching vlsi search block-matching novel low-power architectures hardware full-search feature hierarchical its implementation cmos filter flexible algorithms pursuit new data
Topic 04, networks streaming over wireless systems multicast allocation distributed resource optimization transmission vbr atm video-on-demand energy mpeg joint traffic channel layered
Topic 05, visual recognition videos network surveillance summarization event models markov model random neural activity devices mobile field system conditional content mixture
Topic 06, filter color filters interpolation application conversion signals motion-compensated subband fir hardware processing its method progressive scheme fuzzy filtering multiplier super-resolution
Topic 07, multiple description scheme h.264 wyner-ziv quantization reference domain side fractal frame pictures internet scalar streaming decomposition single two-stage svc quantizer
Topic 08, transmission over error wireless channels networks error-resilient communication streaming protection correction mobile transport packet atm h.263 concealment optimized schemes codes
Topic 09, from facial dynamic mpeg-4 human animation sequences sequence parameters removal noise modeling linear model movement patterns fusion search residual pose
Topic 10, stereo approach systems flow local matching hybrid text disparity optical localization compressed accurate bayesian through modeling boundary domain accuracy people
Topic 11, compensation filtering enhancement deblocking visual method directional region-based resolution local weighted environment super-resolution reduced contrast dct-domain stereoscopic displays multiview saliency
Topic 12, reduction blocking compressed artifacts wavelet technique coded advanced arithmetic noise region effect sequences low-complexity postprocessing artifact iterative mechanism block-coded multipoint
Topic 13, objects automatic object segmentation system moving sequences background adaptation tracking from model-based applications camera multiple generation face extraction reconstruction cameras
Topic 14, tracking object segmentation via visual representation multiple fusion hierarchical improved dynamic contour particle clustering framework feature active probabilistic global color
Topic 15, error concealment techniques temporal algorithms packet enhanced approach information without spatial mpeg-2 improving errors jpeg2000 resilience drift transmission block-matching loss
Topic 16, quality assessment perceptual applications metric methods novel visual stereoscopic evaluation study optimization display no-reference subjective scanning spatio-temporal effects algorithms model
Topic 17, variable multiview block-based coder depth under h.264 length content constraints effective map scheduling decision mode interpolation correlation encoding switching early
Topic 18, object-based multiview synthesis mesh sequences view correction stereo three-dimensional model film geometry regression predictive rendering optimal compensation nonlinear spectral system
Topic 19, model its mpeg application compressed dct domain distortion modeling coder videos spatially spatiotemporal quantization global generalized time frame theory segmentation
Topic 20, recognition human representation face learning action features classification spatio-temporal pattern method scene sparse similarity information gait tensor measure statistical unsupervised
Topic 21, allocation bit rate-distortion mpeg-4 joint shape optimal optimization texture optimized dependent progressive subband generalized transmission via codecs models object-based framework
Topic 22, low bit-rate bit very wavelet-based codec hierarchical subband partitioning h.263 trees rates spiht wavelet embedded comparison stream decomposition technique regions
Topic 23, discrete 2-d wavelet implementation cosine transforms vlsi new scheme parallel architectures two-dimensional its orthogonal dct computation hdtv processor integer inverse
Topic 24, complexity performance encoding search algorithms memory reduction low frame binary new feedback multimedia computational distributed power pyramid load up-conversion requirements
Topic 25, mode decision frame intra compensation prediction h.264 transcoding interpolation scheme mpeg-2 hybrid selection hierarchical method transcoder cost entropy hevc dynamic
Topic 26, special introduction issue standard efficiency high hevc mpeg-7 overview multimedia extension visual framework content tools editorial guest emerging fine descriptor
Topic 27, prediction spatial motion-compensated coders scalability temporal wavelet denoising modeling statistical combined multiresolution techniques compensated filtering quadtree recursive h.264/svc decoding domain
Topic 28, data method dct technique hiding distortion improved arbitrarily reversible shaped blocks coefficients information texture embedding lossless block-based macroblock optimal prediction
Topic 29, decoder encoder high jpeg decoding cabac memory surveillance survey 2000 selective parallel method cavlc encryption access new definition high-throughput authentication
