Topic, Top Terms
Topic 00, case tools effects e-learning higher patterns analytical interaction competitive multiple open-source simulation introductory methods are requirements how pid access interactive
Topic 01, based distance web-based performance peer adaptive java simulation-based technologies management collaboration achievement concept database network algorithm communication collaborative introduction synchronous
Topic 02, robotics experimental program developing prototyping rapid autonomous overview game perspectives challenges function introductory international internet-based electricity object-oriented signals interactive methods
Topic 03, embedded curriculum architecture research internet computing support studies mobile topics survey information web fpga distributed managing framework introductory language interactive
Topic 04, simulation power modeling feedback electronics hardware matlab/simulink converters state educating nonlinear via characterization controller supply problems building tools materials principles
Topic 05, evaluation testing experience application automation pedagogical noise competition computer-assisted international model fuzzy game fundamentals world knowledge multimedia introductory issues class
Topic 06, science into integrating projects board practical group linear freshman matlab early formal assignments organization tutorial advanced current function introduction simulation
Topic 07, assessment student classroom motivation plagiarism use impact operating microprocessor blended improve large devices class improved performance enhance automated introductory representation
Topic 08, editorial guest electromagnetics that exercises issue strategies outreach organization grid technologies knowledge outcomes comments pedagogical reply factors enhancing continuing improvements
Topic 09, through enhancing data acquisition use e-learning modular experiences first-year introductory signals comments distributed reply way supporting faculty are interactive object-oriented
Topic 10, circuit process use dynamic algorithms improving theory training basic electric work representation managing issues introductory interactive way materials how are
Topic 11, instruction wireless experiment level low-cost intelligent computer-based method graphical networking fundamentals motors robot versus introducing principles projects strategies synchronous outreach
Topic 12, understanding energy automated measurement machines problem application frequency response new capstone simple developing part editorial ieee technique bioinformatics framework how
Topic 13, online magnetic concepts instructional implementing matlab-based network technique levitation didactic laboratories experiments interactive simple understanding content introductory review toward requirements
Topic 14, virtual experiments laboratories experimental optical networks sensor effect communication strategy supplies low-cost correction studio mobile physical pedagogical electricity signals introductory
Topic 15, environment ece vision assessing university perspective future industry beyond semiconductor agile dsp through creating class interactive review toward language law
Topic 16, methodology projects teach electronic advanced processes multidisciplinary innovative improve industrial real research integrated robot web-based training interactive world use virtual
Topic 17, from test experiences results automatic electromagnetic mechatronics curriculum field solutions scattering learn management race content part applications programmable studio way
Topic 18, classroom motor integration into active curricula induction computing across literacy equations technological electric three-phase strategies challenges drives survey introductory are
Topic 19, method new amplifier techniques voltage differential current mos circuit practical load gain output active integrated undergraduates pedagogical exercise architecture tutorial
Topic 20, awards communications ieee society conference project-based methodology effects planning example university board introductory framework access identification comments language are signals
Topic 21, electronics power project-based activities lab applied enhance assessment first through drives experimental application research electricity integration continuing requirements introductory theorem
Topic 22, technology program information network curriculum image security innovative effective evaluation display dynamics effectiveness mobile services degree physical student open-source toward
Topic 23, hands-on platform interdisciplinary undergraduates enhanced transmission introducing example radar modules wireless applications simple first-year introductory modular interactive bioinformatics review way
Topic 24, mobile lego robots lab teach nxt mindstorms fabrication mechatronics impact how internet-based improvements distributed are faculty intelligent introductory identification access
Topic 25, circuits electronic integrated graduate instrumentation interface circuit microwave measurement analog device physics computation tools novel simulator senior equation estimation power
Topic 26, logic engineers student programmable controllers module elementary drive fuzzy sequential comparison asynchronous creating introducing interactive effectiveness correction use fpga methods
Topic 27, program school experience remote skills outreach high k-12 professional nanotechnology teacher based platform mechatronics support correction degree multidisciplinary electricity continuing
Topic 28, remote web case virtual problem-based collaborative assessment science applications open tutoring masters outcomes telecommunications photonics lab planning mobile research power
Topic 29, web-based implementation processing signal model real-time demonstration evaluating evaluation technological based exercise perspectives framework fpga object-oriented language interactive access issues
