Topic, Top Terms
Topic 00, programming through learning verification linear online fault reduction policies dual robot recognition deadlock supervisor physical monitoring 3-d specification allocation complexity
Topic 01, net manufacturing supervisor maximally theory policy flexible deadlock supervision function tags surface monitoring service automatic rapid assessment effective safety force
Topic 02, automatic efficient routing method manufacturing handling material simulation-based thin policy general algorithm application improvement part virtual search specification complexity parts
Topic 03, supply chain selection vision-based planning lagrangian cells delivery multiple relaxation method 3-d dynamics injection strategy complexity parts micromanipulation products cell
Topic 04, manufacturing flexible quality decomposition operations batch application industry passive rfid product tags assessment service parts physical surface rapid function effective
Topic 05, data information single time estimation identification value feedback large-scale predictive solution semantic cell surface response micromanipulation surfaces specification force injection
Topic 06, tracking motion constrained laser manipulation minimize direct metal mechanisms errors robust dual effective compensation assessment rapid strategy nanoscale dna 3-d
Topic 07, analysis complex services method composition web mechanism experimental language warehouse net-based serial production search service processing parts finite specification dynamics
Topic 08, problems inventory structure maintenance policies assignment components demand vehicles flexible interaction degradation effective case under relaxation virtual search monitoring assessment
Topic 09, analysis new multistage fixture variation kinematic solution general approaches 3-d multistation service strategy micromanipulation dynamics nanoscale effective microarray degradation force
Topic 10, detection nets analysis synthesis timed production application processing microarray dna nanoscale dynamics automatic cell monitoring safety response rapid degradation multistation
Topic 11, energy study automotive shop case paint throughput smart improvement management multiple two-level time surfaces effective safety 3-d degradation strategy search
Topic 12, framework its product space measurement application redundancy manipulators multiobjective coordination semantic task from implementation multistation complexity function virtual cyclic environment
Topic 13, parallel environment sensors via compliant processing force dynamics home nanoscale rapid atomic afm cell response virtual injection development micromanipulation degradation
Topic 14, rfid algorithms feature inspection method tag estimation adaptive aloha frame transportation algorithm 3-d tags parts complexity service two-level processing force
Topic 15, time tools cluster analysis constraints residency variation schedulability constraint bounded subject activity real-time schedule small solution nets wafer productivity atomic
Topic 16, robot mobile robots analysis times moving part novel nanomanipulation tools power compensation response cyclic afm 3-d processing dynamics service tags
Topic 17, editorial guest engineering special section microassembly sensing small drug rfid delivery quality case physical tags dynamics under nanoscale micromanipulation compensation
Topic 18, planning optical coordinated path transport operations framework multiple detection real-time fixture moving serial errors cell surfaces parts sequence function micromanipulation
Topic 19, supervisory multiple robust vehicle cost disassembly product production network failures resource complexity cyclic virtual under surface degradation dynamics service parts
Topic 20, discrete-event fabrication wafer decentralized net local extended specifications finite algorithm microarray specification compensation dna service strategy assessment monitoring 3-d force
Topic 21, sensor network development energy integrated building sequence active recognition products management robust intelligent activity home resources web programming passive under
Topic 22, algorithm selection images prediction industrial real-time intelligent paint separation transfer spray resources monitoring processing implementation effective cell complexity injection schedule
Topic 23, lines flow machines production robotic parallel continuous bernoulli robots throughput cells integrated productivity motion parts finite cyclic implementation nanoscale injection
Topic 24, distributed localization improvement fault approaches power productivity flow failures function effective implementation relaxation two-level specification force afm parts service monitoring
Topic 25, resource constraints multiagent allocation computation visual adaptive multiple task under dynamics search cyclic interaction force automatic monitoring service subject atomic
Topic 26, stochastic calibration chains approximation supply manipulation deterministic methods synthesis nets quality batch programming safety finite surfaces nanoscale relaxation strategy monitoring
Topic 27, diagnosis event discrete management net-based failures under monitoring safety multistation 3-d atomic service strategy force specification schedule afm assessment nanoscale
Topic 28, models from autonomous behavior neural human intelligent smart management supervision surface home supervisor monitoring surfaces implementation dynamics force processing strategy
Topic 29, manufacturing simulation semiconductor planning production generation hierarchical open test study case implementation surfaces multistation 3-d micromanipulation two-level function effective monitoring
