Topic, Top Terms
Topic 0, efficient classification scalable flow information hardware architectural system algorithm optimization control simd support effective generation on-chip microarchitecture profiling multiprocessors stream
Topic 1, with compiler architectures analysis exploiting processor embedded optimization performance exploring framework chip energy multiprocessors automatic high-performance flexible improve java machine
Topic 2, processors register reducing through smt stream performance compiler exploiting energy multithreaded vliw architecture optimal parallelism thread parallelization thermal analysis exploring
Topic 3, modeling exploration optimization control hardware space via architectural architectures framework flow simd management hybrid implementation support microarchitecture misses evaluation approach
Topic 4, cache shared prefetching adaptive last-level management mechanism framework evaluation cores chip energy architecture multiprocessors optimization hybrid algorithm performance implementation heterogeneous
Topic 5, instruction scheduling energy-efficient fast toward algorithm optimization thread with approach scalable framework architectures architecture vliw optimal system compilation mechanism information
