Topic,Top Terms
Natural Language Processing,chinese document spoken generation discriminative automatic combination character mining modeling name text semantic resolution answering question data words parsing its
Natural Language Processing-1,hindi study languages search comparative with models monolingual transliteration automatic its modeling generation question labeling application name detection tracking parsing
Information Retrieval,knowledge lexical corpora bilingual textual analysis mining entity text tracking discriminative patterns semantic question transliteration named its detection automatic modeling
Information Retrieval-1,texts korean monolingual automatic categorization mining text resolution its modeling method analysis question answering application detection identification data labeling disambiguation
Natural Language Processing-2,with system models named speech improving entity text discriminative parsing its detection patterns data semantic method automatic analysis tracking question
Information Retrieval-2,between web comparison corpus semantic text mining english words transliteration method labeling data time its application detection automatic categorization resolution
Natural Language Processing-3,chinese cross-lingual english query modeling character disambiguation semantic hindi name resolution generation analysis automatic words detection mining identification question patterns
Natural Language Processing-4,chinese framework segmentation tagging unified time semantic modeling detection words resolution entity labeling disambiguation discriminative character combination name automatic identification
Natural Language Processing-5,special introduction issue processing temporal natural chinese modeling tracking disambiguation parsing languages detection method transliteration mining entity time combination resolution
